{
  "$schema": "http://json-schema.org/draft-07/schema#",
  "additionalProperties": true,
  "properties": {
    "acquisitionMetadata": {
      "additionalProperties": {
        "type": "string"
      },
      "description": "Open string map. Well-known keys: mission.id, session.id, device.id, capture.kind, acquisition.sensorId, voice.duration.ms, voice.codec, voice.sample.rate.hz, voice.language.hint. Unknown keys are data and must be preserved.",
      "type": "object"
    },
    "acquisitionMethod": {
      "enum": [
        "DEPTH_SENSING",
        "VISUAL_RECONSTRUCTION",
        "CALIBRATED_REFERENCE",
        "MANUAL_MEASUREMENT",
        "SPECIALIST_INSTRUMENT",
        "VIDEO_FOOTAGE",
        "STILL_IMAGERY",
        "INSTRUMENT_READING",
        "HUMAN_ANSWER",
        "DOCUMENT_REGION",
        "VOICE_NOTE"
      ],
      "type": "string"
    },
    "byteSize": {
      "description": "Payload size in bytes.",
      "minimum": 0,
      "type": "integer"
    },
    "capturedAt": {
      "description": "Acquisition instant (UTC).",
      "pattern": "^\\d{4}-\\d{2}-\\d{2}T\\d{2}:\\d{2}:\\d{2}\\.\\d{3}Z$",
      "type": "string"
    },
    "contentId": {
      "description": "Content address: sha-256 over the AISE-CONTENT-V1 canonical encoding of (payload, acquisitionMetadata). This IS the evidence identity.",
      "pattern": "^[0-9a-f]{64}$",
      "type": "string"
    },
    "contractVersion": {
      "description": "Strict semver contract version carried by every wire object. Decoders accept the same major version; any other version is a typed error.",
      "pattern": "^(0|[1-9]\\d*)\\.(0|[1-9]\\d*)\\.(0|[1-9]\\d*)(?:-[0-9A-Za-z-]+(?:\\.[0-9A-Za-z-]+)*)?(?:\\+[0-9A-Za-z-]+(?:\\.[0-9A-Za-z-]+)*)?$",
      "type": "string"
    },
    "mediaType": {
      "description": "IANA-style media type of the content.",
      "pattern": "^[a-zA-Z0-9][a-zA-Z0-9!#$&^_.+-]{0,126}\\/[a-zA-Z0-9][a-zA-Z0-9!#$&^_.+-]{0,126}$",
      "type": "string"
    }
  },
  "required": [
    "contractVersion",
    "contentId",
    "byteSize",
    "mediaType",
    "capturedAt",
    "acquisitionMethod",
    "acquisitionMetadata"
  ],
  "type": "object"
}
