{
  "contractVersion": "1.1.0",
  "contentId": "b1f5de0e80d632a4c7ab9d9536cd4516804852cd29913229944f3625ea6f5f40",
  "byteSize": 4821934,
  "mediaType": "image/jpeg",
  "capturedAt": "2026-01-15T09:36:12.000Z",
  "acquisitionMethod": "STILL_IMAGERY",
  "acquisitionMetadata": {
    "mission.id": "mission-2026-000042",
    "session.id": "session-2026-0007",
    "device.id": "device-field-007",
    "capture.kind": "still",
    "acquisition.sensorId": "rear-wide",
    "lens.focal.length.mm": "6.9",
    "orientation.landscape": "true"
  }
}
